{
  "$schema": "schemas/config.schema.json",
  "schema_version": "slm_direct/v1",
  "research_plan_version": "2.14",
  "protocol_frozen": true,
  "question_file": "../LLM_API_direct/questions/four_system_all_questions.jsonl",
  "question_manifest_file": "../LLM_API_direct/questions/four_system_all_questions.manifest.json",
  "evaluator_gold_file": "../LLM_API_direct/questions/four_system_all_gold.evaluator.jsonl",
  "analysis_sets_file": "../LLM_API_direct/questions/four_system_analysis_sets.json",
  "answer_schema": "schemas/diffusion_answer.schema.json",
  "output_root": "../results/SLM_direct/protocol_v2_2",
  "repetitions": 3,
  "order_seed": 42,
  "timeout_seconds": 180,
  "inter_request_seconds": 0.1,
  "retry": {
    "max_attempts_per_sample": 5,
    "max_elapsed_seconds_per_sample": 900,
    "base_wait_seconds": 2,
    "max_wait_seconds": 30,
    "jitter_fraction": 0.2
  },
  "server": {
    "base_url": "http://localhost:1234/v1",
    "native_models_url": "http://localhost:1234/api/v1/models",
    "api_key_env": "LM_STUDIO_API_KEY",
    "require_loopback": false,
    "require_native_metadata": true,
    "require_single_loaded_instance": true,
    "preflight_timeout_seconds": 10
  },
  "inference": {
    "structured_output": "json_schema",
    "temperature": 0,
    "top_p": 1.0,
    "seed": null,
    "max_output_tokens": 256,
    "extra_body": {}
  },
  "models": {
    "qwen3_4b_instruct_2507_base_q4km": {
      "enabled": true,
      "formal_ready": true,
      "display_name": "Qwen3-4B-Instruct-2507",
      "model_family": "qwen3",
      "expected_lmstudio_architecture": "qwen3",
      "served_model_id": "cet-gguf/qwen3-4b-instruct-2507@q4_k_m",
      "pair_id": "qwen3_4b_instruct_2507",
      "pair_role": "base",
      "paired_model_keys": [],
      "model_variant": "original_instruct",
      "experiment_arm": "A_base_direct",
      "fold_id": null,
      "primary_anchor": true,
      "chat_template": "qwen3_nothink",
      "gguf_template_family": "qwen_chatml",
      "reasoning_mode": "disabled",
      "system_message_policy": "native_system_role",
      "question_ids_file": null,
      "base_checkpoint": {
        "modelscope_id": "Qwen/Qwen3-4B-Instruct-2507",
        "revision": "2de2439ea21be1dc5cb21f22f88af07e43393cbb",
        "snapshot_manifest_sha256": "94a9995f03402bc19d1a2f5f718c9b82d883302c56be12ae6fe75e4d5a0e4df2"
      },
      "parent_base": {},
      "sft_artifacts": {},
      "training_provenance": {},
      "gguf": {
        "connectivity_repo": "unsloth/Qwen3-4B-Instruct-2507-GGUF",
        "connectivity_filename": "Qwen3-4B-Instruct-2507-Q4_K_M.gguf",
        "source_kind": "self_converted",
        "filename": "qwen3-4b-instruct-2507-Q4_K_M.gguf",
        "local_path": "E:\\gguf\\cet_formal\\qwen3-4b-instruct-2507-Q4_K_M.gguf",
        "sha256": "0f5e5250018ea2e4384e8b440f3a51fd1fff31d6694906e63fca3b5abd8a9a28",
        "quantization": "Q4_K_M",
        "converter": "llama.cpp",
        "converter_commit": "d0bfb1981266c271cd0536a8aa7c5e863e7cdf61",
        "imatrix_policy": "none",
        "imatrix_sha256": null
      },
      "deployment": {
        "lmstudio_load_key": "cet-gguf/qwen3-4b-instruct-2507@q4_k_m",
        "native_model_key": "cet-gguf/qwen3-4b-instruct-2507@q4_k_m",
        "native_selected_variant": null,
        "lm_studio_app_version": "0.4.20+1",
        "lm_studio_runtime_version": "llama.cpp-win-x86_64-avx2-2.29.0",
        "context_length": 4096,
        "gpu_offload": "max",
        "prompt_template_override": false
      }
    },
    "qwen3_8b_instruct_base_q4km": {
      "enabled": true,
      "formal_ready": true,
      "display_name": "Qwen3-8B",
      "model_family": "qwen3",
      "expected_lmstudio_architecture": "qwen3",
      "served_model_id": "qwen3-8b-instruct@q4_k_m",
      "pair_id": "qwen3_8b_instruct",
      "pair_role": "base",
      "paired_model_keys": [],
      "model_variant": "original_instruct",
      "experiment_arm": "A_base_direct",
      "fold_id": null,
      "primary_anchor": false,
      "chat_template": "qwen3_nothink",
      "gguf_template_family": "qwen_chatml",
      "reasoning_mode": "disabled",
      "system_message_policy": "native_system_role",
      "question_ids_file": null,
      "base_checkpoint": {
        "modelscope_id": "Qwen/Qwen3-8B",
        "revision": "26028140be3ee69b82b1d1450179ab71bb1121b9",
        "snapshot_manifest_sha256": "a34491bce8871fef5f3fed8c70ce51db59fff2797acb3e49dc861b81d7ddc7f9"
      },
      "parent_base": {},
      "sft_artifacts": {},
      "training_provenance": {},
      "gguf": {
        "connectivity_repo": "Qwen/Qwen3-8B-GGUF",
        "connectivity_filename": "qwen3-8b-q4_k_m.gguf",
        "connectivity_source_kind": "upstream_official",
        "source_kind": "self_converted",
        "filename": "qwen3-8b-instruct-Q4_K_M.gguf",
        "local_path": "E:\\gguf\\cet_formal\\qwen3-8b-instruct-Q4_K_M.gguf",
        "sha256": "1554ac6e4b8ae5c463e1b6478961394e5895588a4aa381825e065ae1b7fac007",
        "quantization": "Q4_K_M",
        "converter": "llama.cpp",
        "converter_commit": "d0bfb1981266c271cd0536a8aa7c5e863e7cdf61",
        "imatrix_policy": "none",
        "imatrix_sha256": null
      },
      "deployment": {
        "lmstudio_load_key": "qwen3-8b-instruct@q4_k_m",
        "native_model_key": "qwen3-8b-instruct@q4_k_m",
        "native_selected_variant": null,
        "lm_studio_app_version": "0.4.20+1",
        "lm_studio_runtime_version": "llama.cpp-win-x86_64-avx2-2.29.0",
        "context_length": 4096,
        "gpu_offload": "max",
        "prompt_template_override": false
      }
    },
    "llama3_1_8b_instruct_base_q4km": {
      "enabled": true,
      "formal_ready": true,
      "display_name": "Llama-3.1-8B-Instruct",
      "model_family": "llama",
      "expected_lmstudio_architecture": "llama",
      "served_model_id": "llama-3.1-8b-instruct@q4_k_m",
      "pair_id": "llama3_1_8b_instruct",
      "pair_role": "base",
      "paired_model_keys": [],
      "model_variant": "original_instruct",
      "experiment_arm": "A_base_direct",
      "fold_id": null,
      "primary_anchor": false,
      "chat_template": "llama3",
      "gguf_template_family": "llama3_header",
      "reasoning_mode": "not_applicable",
      "system_message_policy": "native_system_role",
      "question_ids_file": null,
      "base_checkpoint": {
        "modelscope_id": "LLM-Research/Meta-Llama-3.1-8B-Instruct",
        "revision": "359efdbb8af05b788a4ad4185215c6b8caa9052c",
        "snapshot_manifest_sha256": "29248f4d9a24c99da16765cfe1ffb201faba2479b83341462fb1d7da8c4c4dc7"
      },
      "parent_base": {},
      "sft_artifacts": {},
      "training_provenance": {},
      "gguf": {
        "connectivity_repo": "QuantFactory/Meta-Llama-3.1-8B-Instruct-GGUF",
        "connectivity_filename": "Meta-Llama-3.1-8B-Instruct.Q4_K_M.gguf",
        "source_kind": "self_converted",
        "filename": "llama-3.1-8b-instruct-Q4_K_M.gguf",
        "local_path": "E:\\gguf\\cet_formal\\llama-3.1-8b-instruct-Q4_K_M.gguf",
        "sha256": "89e19c221157d7eef6d969c039cf23e61bb795c6c3218c3d286448bda899c688",
        "quantization": "Q4_K_M",
        "converter": "llama.cpp",
        "converter_commit": "d0bfb1981266c271cd0536a8aa7c5e863e7cdf61",
        "imatrix_policy": "none",
        "imatrix_sha256": null
      },
      "deployment": {
        "lmstudio_load_key": "llama-3.1-8b-instruct@q4_k_m",
        "native_model_key": "llama-3.1-8b-instruct@q4_k_m",
        "native_selected_variant": null,
        "lm_studio_app_version": "0.4.20+1",
        "lm_studio_runtime_version": "llama.cpp-win-x86_64-avx2-2.29.0",
        "context_length": 4096,
        "gpu_offload": "max",
        "prompt_template_override": false
      }
    },
    "qwen3_6_27b_base_q4km": {
      "enabled": true,
      "formal_ready": true,
      "display_name": "Qwen3.6-27B",
      "model_family": "qwen3",
      "expected_lmstudio_architecture": "qwen35",
      "served_model_id": "qwen3.6-27b@q4_k_m",
      "pair_id": "qwen3_6_27b",
      "pair_role": "base",
      "paired_model_keys": [],
      "model_variant": "original_instruct",
      "experiment_arm": "A_base_direct",
      "fold_id": null,
      "primary_anchor": false,
      "chat_template": "qwen3_nothink",
      "gguf_template_family": "qwen_chatml",
      "reasoning_mode": "disabled",
      "system_message_policy": "native_system_role",
      "question_ids_file": null,
      "base_checkpoint": {
        "modelscope_id": "Qwen/Qwen3.6-27B",
        "revision": "cea40373b9214dd387123e68841890af30dcd469",
        "snapshot_manifest_sha256": "6f82553ba0f2ac2eb83e72909c89111363a2db7a6653942549294212e41f2afc"
      },
      "parent_base": {},
      "sft_artifacts": {},
      "training_provenance": {},
      "gguf": {
        "connectivity_repo": "Qwen/Qwen3.6-27B-GGUF",
        "connectivity_filename": "qwen3.6-27b-q4_k_m.gguf",
        "connectivity_source_kind": "upstream_official",
        "source_kind": "self_converted",
        "filename": "qwen3.6-27b-Q4_K_M.gguf",
        "local_path": "E:\\gguf\\cet_formal\\qwen3.6-27b-Q4_K_M.gguf",
        "sha256": "0b4d82bcbb9f36cbb9df6f6e3060d9fea6be5ee970305312c3436575ddfb4a96",
        "quantization": "Q4_K_M",
        "converter": "llama.cpp",
        "converter_commit": "d0bfb1981266c271cd0536a8aa7c5e863e7cdf61",
        "imatrix_policy": "none",
        "imatrix_sha256": null
      },
      "deployment": {
        "lmstudio_load_key": "qwen3.6-27b@q4_k_m",
        "native_model_key": "qwen3.6-27b@q4_k_m",
        "native_selected_variant": null,
        "lm_studio_app_version": "0.4.20+1",
        "lm_studio_runtime_version": "llama.cpp-win-x86_64-avx2-2.29.0",
        "context_length": 4096,
        "gpu_offload": "max",
        "prompt_template_override": false
      }
    },
    "gemma2_9b_it_base_q4km": {
      "enabled": true,
      "formal_ready": true,
      "display_name": "Gemma-2-9B-it",